{
  "schema": "https://agent-atoms.com/schemas/rule-v1.json",
  "type": "isolation-rule",
  "id": "network-write-requires-allowlist",
  "version": "1.0.0",
  "name": "Network-write tools require an allowlisted network",
  "description": "tool/http-post requires isolation in {container-with-allowlist, network-namespaced}. A side-effecting HTTP method without an allowlist can post to arbitrary external hosts.",
  "predicate": {
    "subject_ref": "agent-atoms://atoms/tool-definition/http-post",
    "condition": "in",
    "value": [
      "agent-atoms://atoms/isolation-constraint/container-with-allowlist",
      "agent-atoms://atoms/isolation-constraint/network-namespaced"
    ]
  },
  "effect": "require",
  "rationale": "Side-effecting HTTP (POST/PUT/PATCH/DELETE) is the standard data-exfiltration vector. Pair it with network-allowlist isolation so the destination set is known and small."
}
